act,scene,scene_line,role,file_name,file_lineno,line
III,I,111,MACBETH,1533-0.txt,1833,"And I will put that business in your bosoms,"
III,I,112,MACBETH,1533-0.txt,1834,"Whose execution takes your enemy off,"
III,I,113,MACBETH,1533-0.txt,1835,"Grapples you to the heart and love of us,"
III,I,114,MACBETH,1533-0.txt,1836,"Who wear our health but sickly in his life,"
III,I,115,MACBETH,1533-0.txt,1837,Which in his death were perfect.
III,I,116,SECOND MURDERER,1533-0.txt,1840,"I am one, my liege,"
III,I,117,SECOND MURDERER,1533-0.txt,1841,Whom the vile blows and buffets of the world
III,I,118,SECOND MURDERER,1533-0.txt,1842,Hath so incens’d that I am reckless what
III,I,119,SECOND MURDERER,1533-0.txt,1843,I do to spite the world.
III,I,120,FIRST MURDERER,1533-0.txt,1846,"And I another,"
III,I,121,FIRST MURDERER,1533-0.txt,1847,"So weary with disasters, tugg’d with fortune,"
III,I,122,FIRST MURDERER,1533-0.txt,1848,"That I would set my life on any chance,"
III,I,123,FIRST MURDERER,1533-0.txt,1849,To mend it or be rid on’t.
III,I,124,MACBETH,1533-0.txt,1852,Both of you
III,I,125,MACBETH,1533-0.txt,1853,Know Banquo was your enemy.
III,I,126,BOTH MURDERERS,1533-0.txt,1856,"True, my lord."
III,I,127,MACBETH,1533-0.txt,1859,"So is he mine; and in such bloody distance,"
III,I,128,MACBETH,1533-0.txt,1860,That every minute of his being thrusts
III,I,129,MACBETH,1533-0.txt,1861,Against my near’st of life; and though I could
III,I,130,MACBETH,1533-0.txt,1862,"With barefac’d power sweep him from my sight,"
III,I,131,MACBETH,1533-0.txt,1863,"And bid my will avouch it, yet I must not,"
III,I,132,MACBETH,1533-0.txt,1864,"For certain friends that are both his and mine,"
III,I,133,MACBETH,1533-0.txt,1865,"Whose loves I may not drop, but wail his fall"
III,I,134,MACBETH,1533-0.txt,1866,Who I myself struck down: and thence it is
III,I,135,MACBETH,1533-0.txt,1867,"That I to your assistance do make love,"
III,I,136,MACBETH,1533-0.txt,1868,Masking the business from the common eye
III,I,137,MACBETH,1533-0.txt,1869,For sundry weighty reasons.
III,I,138,SECOND MURDERER,1533-0.txt,1872,"We shall, my lord,"
III,I,139,SECOND MURDERER,1533-0.txt,1873,Perform what you command us.
III,I,140,FIRST MURDERER,1533-0.txt,1876,Though our lives— 
III,I,141,MACBETH,1533-0.txt,1879,"Your spirits shine through you. Within this hour at most,"
III,I,142,MACBETH,1533-0.txt,1880,"I will advise you where to plant yourselves,"
III,I,143,MACBETH,1533-0.txt,1881,"Acquaint you with the perfect spy o’ th’ time,"
III,I,144,MACBETH,1533-0.txt,1882,The moment on’t; for’t must be done tonight
III,I,145,MACBETH,1533-0.txt,1883,And something from the palace; always thought
III,I,146,MACBETH,1533-0.txt,1884,That I require a clearness. And with him
III,I,147,MACBETH,1533-0.txt,1885,(To leave no rubs nor botches in the work)
III,I,148,MACBETH,1533-0.txt,1886,"Fleance his son, that keeps him company,"
III,I,149,MACBETH,1533-0.txt,1887,Whose absence is no less material to me
III,I,150,MACBETH,1533-0.txt,1888,"Than is his father’s, must embrace the fate"
III,I,151,MACBETH,1533-0.txt,1889,Of that dark hour. Resolve yourselves apart.
III,I,152,MACBETH,1533-0.txt,1890,I’ll come to you anon.
III,I,153,BOTH MURDERERS,1533-0.txt,1893,"We are resolv’d, my lord."
III,I,154,MACBETH,1533-0.txt,1896,I’ll call upon you straight: abide within.
III,I,154,---,1533-0.txt,1898,[Exeunt Murderers.]
III,I,155,MACBETH,1533-0.txt,1900,"It is concluded. Banquo, thy soul’s flight,"
III,I,156,MACBETH,1533-0.txt,1901,"If it find heaven, must find it out tonight."
III,I,156,---,1533-0.txt,1903,[Exit.]
III,II,0,---,1533-0.txt,1907,Enter Lady Macbeth and a Servant.
III,II,1,LADY MACBETH,1533-0.txt,1910,Is Banquo gone from court?
III,II,2,SERVANT,1533-0.txt,1913,"Ay, madam, but returns again tonight."
III,II,3,LADY MACBETH,1533-0.txt,1916,"Say to the King, I would attend his leisure"
III,II,4,LADY MACBETH,1533-0.txt,1917,For a few words.
III,II,5,SERVANT,1533-0.txt,1920,"Madam, I will."
III,II,5,---,1533-0.txt,1922,[Exit.]
III,II,6,LADY MACBETH,1533-0.txt,1925,"Naught’s had, all’s spent,"
III,II,7,LADY MACBETH,1533-0.txt,1926,Where our desire is got without content:
III,II,8,LADY MACBETH,1533-0.txt,1927,"’Tis safer to be that which we destroy,"
III,II,9,LADY MACBETH,1533-0.txt,1928,Than by destruction dwell in doubtful joy.
III,II,9,---,1533-0.txt,1930,Enter Macbeth.
III,II,10,LADY MACBETH,1533-0.txt,1932,"How now, my lord, why do you keep alone,"
III,II,11,LADY MACBETH,1533-0.txt,1933,"Of sorriest fancies your companions making,"
III,II,12,LADY MACBETH,1533-0.txt,1934,Using those thoughts which should indeed have died
III,II,13,LADY MACBETH,1533-0.txt,1935,With them they think on? Things without all remedy
III,II,14,LADY MACBETH,1533-0.txt,1936,Should be without regard: what’s done is done.
III,II,15,MACBETH,1533-0.txt,1939,"We have scorch’d the snake, not kill’d it."
III,II,16,MACBETH,1533-0.txt,1940,"She’ll close, and be herself; whilst our poor malice"
III,II,17,MACBETH,1533-0.txt,1941,Remains in danger of her former tooth.
III,II,18,MACBETH,1533-0.txt,1942,"But let the frame of things disjoint,"
III,II,19,MACBETH,1533-0.txt,1943,"Both the worlds suffer,"
III,II,20,MACBETH,1533-0.txt,1944,"Ere we will eat our meal in fear, and sleep"
III,II,21,MACBETH,1533-0.txt,1945,In the affliction of these terrible dreams
III,II,22,MACBETH,1533-0.txt,1946,"That shake us nightly. Better be with the dead,"
III,II,23,MACBETH,1533-0.txt,1947,"Whom we, to gain our peace, have sent to peace,"
III,II,24,MACBETH,1533-0.txt,1948,Than on the torture of the mind to lie
III,II,25,MACBETH,1533-0.txt,1949,In restless ecstasy. Duncan is in his grave;
III,II,26,MACBETH,1533-0.txt,1950,After life’s fitful fever he sleeps well;
III,II,27,MACBETH,1533-0.txt,1951,"Treason has done his worst: nor steel, nor poison,"
III,II,28,MACBETH,1533-0.txt,1952,"Malice domestic, foreign levy, nothing"
III,II,29,MACBETH,1533-0.txt,1953,Can touch him further.
III,II,30,LADY MACBETH,1533-0.txt,1956,"Come on,"
III,II,31,LADY MACBETH,1533-0.txt,1957,"Gently my lord, sleek o’er your rugged looks;"
III,II,32,LADY MACBETH,1533-0.txt,1958,Be bright and jovial among your guests tonight.
III,II,33,MACBETH,1533-0.txt,1961,"So shall I, love; and so, I pray, be you."
III,II,34,MACBETH,1533-0.txt,1962,Let your remembrance apply to Banquo;
III,II,35,MACBETH,1533-0.txt,1963,"Present him eminence, both with eye and tongue:"
III,II,36,MACBETH,1533-0.txt,1964,"Unsafe the while, that we"
III,II,37,MACBETH,1533-0.txt,1965,"Must lave our honours in these flattering streams,"
III,II,38,MACBETH,1533-0.txt,1966,"And make our faces vizards to our hearts,"
III,II,39,MACBETH,1533-0.txt,1967,Disguising what they are.
III,II,40,LADY MACBETH,1533-0.txt,1970,You must leave this.
III,II,41,MACBETH,1533-0.txt,1973,"O, full of scorpions is my mind, dear wife!"
III,II,42,MACBETH,1533-0.txt,1974,"Thou know’st that Banquo, and his Fleance, lives."
III,II,43,LADY MACBETH,1533-0.txt,1977,But in them nature’s copy’s not eterne.
III,II,44,MACBETH,1533-0.txt,1980,There’s comfort yet; they are assailable.
III,II,45,MACBETH,1533-0.txt,1981,Then be thou jocund. Ere the bat hath flown
III,II,46,MACBETH,1533-0.txt,1982,"His cloister’d flight, ere to black Hecate’s summons"
III,II,47,MACBETH,1533-0.txt,1983,"The shard-born beetle, with his drowsy hums,"
III,II,48,MACBETH,1533-0.txt,1984,"Hath rung night’s yawning peal, there shall be done"
III,II,49,MACBETH,1533-0.txt,1985,A deed of dreadful note.
III,II,50,LADY MACBETH,1533-0.txt,1988,What’s to be done?
III,II,51,MACBETH,1533-0.txt,1991,"Be innocent of the knowledge, dearest chuck,"
III,II,52,MACBETH,1533-0.txt,1992,"Till thou applaud the deed. Come, seeling night,"
III,II,53,MACBETH,1533-0.txt,1993,"Scarf up the tender eye of pitiful day,"
III,II,54,MACBETH,1533-0.txt,1994,And with thy bloody and invisible hand
III,II,55,MACBETH,1533-0.txt,1995,Cancel and tear to pieces that great bond
III,II,56,MACBETH,1533-0.txt,1996,Which keeps me pale!— Light thickens; and the crow
III,II,57,MACBETH,1533-0.txt,1997,Makes wing to th’ rooky wood.
III,II,58,MACBETH,1533-0.txt,1998,"Good things of day begin to droop and drowse,"
III,II,59,MACBETH,1533-0.txt,1999,Whiles night’s black agents to their preys do rouse.
III,II,60,MACBETH,1533-0.txt,2000,Thou marvell’st at my words: but hold thee still;
III,II,61,MACBETH,1533-0.txt,2001,Things bad begun make strong themselves by ill.
III,II,62,MACBETH,1533-0.txt,2002,"So, pr’ythee, go with me."
III,II,62,---,1533-0.txt,2004,[Exeunt.]
III,III,0,---,1533-0.txt,2008,Enter three Murderers.
III,III,1,FIRST MURDERER,1533-0.txt,2011,But who did bid thee join with us?
III,III,2,THIRD MURDERER,1533-0.txt,2014,Macbeth.
III,III,3,SECOND MURDERER,1533-0.txt,2017,He needs not our mistrust; since he delivers
III,III,4,SECOND MURDERER,1533-0.txt,2018,Our offices and what we have to do
III,III,5,SECOND MURDERER,1533-0.txt,2019,To the direction just.
III,III,6,FIRST MURDERER,1533-0.txt,2022,Then stand with us.
III,III,7,FIRST MURDERER,1533-0.txt,2023,The west yet glimmers with some streaks of day.
III,III,8,FIRST MURDERER,1533-0.txt,2024,"Now spurs the lated traveller apace,"
III,III,9,FIRST MURDERER,1533-0.txt,2025,To gain the timely inn; and near approaches
III,III,10,FIRST MURDERER,1533-0.txt,2026,The subject of our watch.
III,III,11,THIRD MURDERER,1533-0.txt,2029,Hark! I hear horses.
III,III,12,BANQUO,1533-0.txt,2032,"[Within.] Give us a light there, ho!"
III,III,13,SECOND MURDERER,1533-0.txt,2035,Then ’tis he; the rest
III,III,14,SECOND MURDERER,1533-0.txt,2036,That are within the note of expectation
III,III,15,SECOND MURDERER,1533-0.txt,2037,Already are i’ th’ court.
III,III,16,FIRST MURDERER,1533-0.txt,2040,His horses go about.
III,III,17,THIRD MURDERER,1533-0.txt,2043,"Almost a mile; but he does usually,"
III,III,18,THIRD MURDERER,1533-0.txt,2044,"So all men do, from hence to the palace gate"
III,III,19,THIRD MURDERER,1533-0.txt,2045,Make it their walk.
III,III,19,---,1533-0.txt,2047,Enter Banquo and Fleance with a torch.
III,III,20,SECOND MURDERER,1533-0.txt,2050,"A light, a light!"
III,III,21,THIRD MURDERER,1533-0.txt,2053,’Tis he.
III,III,22,FIRST MURDERER,1533-0.txt,2056,Stand to’t.
III,III,23,BANQUO,1533-0.txt,2059,It will be rain tonight.
III,III,24,FIRST MURDERER,1533-0.txt,2062,Let it come down.
III,III,24,---,1533-0.txt,2064,[Assaults Banquo.]
III,III,25,BANQUO,1533-0.txt,2067,"O, treachery! Fly, good Fleance, fly, fly, fly!"
III,III,26,BANQUO,1533-0.txt,2068,Thou mayst revenge— O slave!
III,III,26,---,1533-0.txt,2070,[Dies. Fleance escapes.]
III,III,27,THIRD MURDERER,1533-0.txt,2073,Who did strike out the light?
III,III,28,FIRST MURDERER,1533-0.txt,2076,Was’t not the way?
III,III,29,THIRD MURDERER,1533-0.txt,2079,There’s but one down: the son is fled.
III,III,30,SECOND MURDERER,1533-0.txt,2082,We have lost best half of our affair.
III,III,31,FIRST MURDERER,1533-0.txt,2085,"Well, let’s away, and say how much is done."
III,III,31,---,1533-0.txt,2087,[Exeunt.]
III,IV,0,---,1533-0.txt,2091,"A banquet prepared. Enter Macbeth, Lady Macbeth, Ross, Lennox, Lords and Attendants."
III,IV,1,MACBETH,1533-0.txt,2095,"You know your own degrees, sit down. At first"
III,IV,2,MACBETH,1533-0.txt,2096,And last the hearty welcome.
III,IV,3,LORDS,1533-0.txt,2099,Thanks to your Majesty.
III,IV,4,MACBETH,1533-0.txt,2102,"Ourself will mingle with society,"
III,IV,5,MACBETH,1533-0.txt,2103,And play the humble host.
III,IV,6,MACBETH,1533-0.txt,2104,"Our hostess keeps her state; but, in best time,"
III,IV,7,MACBETH,1533-0.txt,2105,We will require her welcome.
III,IV,8,LADY MACBETH,1533-0.txt,2108,"Pronounce it for me, sir, to all our friends;"
III,IV,9,LADY MACBETH,1533-0.txt,2109,For my heart speaks they are welcome.
III,IV,9,---,1533-0.txt,2111,Enter first Murderer to the door.
III,IV,10,MACBETH,1533-0.txt,2114,"See, they encounter thee with their hearts’ thanks."
III,IV,11,MACBETH,1533-0.txt,2115,Both sides are even: here I’ll sit i’ th’ midst.
III,IV,12,MACBETH,1533-0.txt,2117,Be large in mirth; anon we’ll drink a measure
III,IV,13,MACBETH,1533-0.txt,2118,The table round. There’s blood upon thy face.
III,IV,14,MURDERER,1533-0.txt,2121,’Tis Banquo’s then.
III,IV,15,MACBETH,1533-0.txt,2124,’Tis better thee without than he within.
III,IV,16,MACBETH,1533-0.txt,2125,Is he dispatch’d?
III,IV,17,MURDERER,1533-0.txt,2128,"My lord, his throat is cut. That I did for him."
III,IV,18,MACBETH,1533-0.txt,2131,Thou art the best o’ th’ cut-throats;
III,IV,19,MACBETH,1533-0.txt,2132,Yet he’s good that did the like for Fleance:
III,IV,20,MACBETH,1533-0.txt,2133,"If thou didst it, thou art the nonpareil."
III,IV,21,MURDERER,1533-0.txt,2136,"Most royal sir,"
III,IV,22,MURDERER,1533-0.txt,2137,Fleance is ’scap’d.
III,IV,23,MACBETH,1533-0.txt,2140,Then comes my fit again: I had else been perfect;
III,IV,24,MACBETH,1533-0.txt,2141,"Whole as the marble, founded as the rock,"
III,IV,25,MACBETH,1533-0.txt,2142,As broad and general as the casing air:
III,IV,26,MACBETH,1533-0.txt,2143,"But now I am cabin’d, cribb’d, confin’d, bound in"
III,IV,27,MACBETH,1533-0.txt,2144,To saucy doubts and fears. But Banquo’s safe?
III,IV,28,MURDERER,1533-0.txt,2147,"Ay, my good lord. Safe in a ditch he bides,"
III,IV,29,MURDERER,1533-0.txt,2148,With twenty trenched gashes on his head;
III,IV,30,MURDERER,1533-0.txt,2149,The least a death to nature.
III,IV,31,MACBETH,1533-0.txt,2152,Thanks for that.
III,IV,32,MACBETH,1533-0.txt,2153,There the grown serpent lies; the worm that’s fled
III,IV,33,MACBETH,1533-0.txt,2154,"Hath nature that in time will venom breed,"
III,IV,34,MACBETH,1533-0.txt,2155,No teeth for th’ present.— Get thee gone; tomorrow
III,IV,35,MACBETH,1533-0.txt,2156,"We’ll hear, ourselves, again."
III,IV,35,---,1533-0.txt,2158,[Exit Murderer.]
III,IV,36,LADY MACBETH,1533-0.txt,2161,"My royal lord,"
III,IV,37,LADY MACBETH,1533-0.txt,2162,You do not give the cheer: the feast is sold
III,IV,38,LADY MACBETH,1533-0.txt,2163,"That is not often vouch’d, while ’tis a-making,"
III,IV,39,LADY MACBETH,1533-0.txt,2164,’Tis given with welcome. To feed were best at home;
III,IV,40,LADY MACBETH,1533-0.txt,2165,From thence the sauce to meat is ceremony;
III,IV,41,LADY MACBETH,1533-0.txt,2166,Meeting were bare without it.
III,IV,41,---,1533-0.txt,2168,"The Ghost of Banquo rises, and sits in Macbeth’s place."
III,IV,42,MACBETH,1533-0.txt,2171,Sweet remembrancer!— 
III,IV,43,MACBETH,1533-0.txt,2172,"Now, good digestion wait on appetite,"
III,IV,44,MACBETH,1533-0.txt,2173,And health on both!
III,IV,45,LENNOX,1533-0.txt,2176,May’t please your Highness sit.
III,IV,46,MACBETH,1533-0.txt,2179,"Here had we now our country’s honour roof’d,"
III,IV,47,MACBETH,1533-0.txt,2180,Were the grac’d person of our Banquo present;
III,IV,48,MACBETH,1533-0.txt,2181,Who may I rather challenge for unkindness
III,IV,49,MACBETH,1533-0.txt,2182,Than pity for mischance!
III,IV,50,ROSS,1533-0.txt,2185,"His absence, sir,"
III,IV,51,ROSS,1533-0.txt,2186,Lays blame upon his promise. Please’t your Highness
III,IV,52,ROSS,1533-0.txt,2187,To grace us with your royal company?
III,IV,53,MACBETH,1533-0.txt,2190,The table’s full.
III,IV,54,LENNOX,1533-0.txt,2193,"Here is a place reserv’d, sir."
III,IV,55,MACBETH,1533-0.txt,2196,Where?
III,IV,56,LENNOX,1533-0.txt,2199,"Here, my good lord. What is’t that moves your Highness?"
III,IV,57,MACBETH,1533-0.txt,2202,Which of you have done this?
III,IV,58,LORDS,1533-0.txt,2205,"What, my good lord?"
III,IV,59,MACBETH,1533-0.txt,2208,Thou canst not say I did it. Never shake
III,IV,60,MACBETH,1533-0.txt,2209,Thy gory locks at me.
III,IV,61,ROSS,1533-0.txt,2212,"Gentlemen, rise; his Highness is not well."
III,IV,62,LADY MACBETH,1533-0.txt,2215,"Sit, worthy friends. My lord is often thus,"
III,IV,63,LADY MACBETH,1533-0.txt,2216,"And hath been from his youth: pray you, keep seat;"
III,IV,64,LADY MACBETH,1533-0.txt,2217,The fit is momentary; upon a thought
III,IV,65,LADY MACBETH,1533-0.txt,2218,"He will again be well. If much you note him,"
III,IV,66,LADY MACBETH,1533-0.txt,2219,"You shall offend him, and extend his passion."
III,IV,67,LADY MACBETH,1533-0.txt,2220,"Feed, and regard him not.— Are you a man?"
III,IV,68,MACBETH,1533-0.txt,2223,"Ay, and a bold one, that dare look on that"
III,IV,69,MACBETH,1533-0.txt,2224,Which might appal the devil.
III,IV,70,LADY MACBETH,1533-0.txt,2227,O proper stuff!
III,IV,71,LADY MACBETH,1533-0.txt,2228,This is the very painting of your fear:
III,IV,72,LADY MACBETH,1533-0.txt,2229,"This is the air-drawn dagger which you said,"
III,IV,73,LADY MACBETH,1533-0.txt,2230,"Led you to Duncan. O, these flaws, and starts"
III,IV,74,LADY MACBETH,1533-0.txt,2231,"(Impostors to true fear), would well become"
III,IV,75,LADY MACBETH,1533-0.txt,2232,"A woman’s story at a winter’s fire,"
III,IV,76,LADY MACBETH,1533-0.txt,2233,Authoris’d by her grandam. Shame itself!
III,IV,77,LADY MACBETH,1533-0.txt,2234,"Why do you make such faces? When all’s done,"
III,IV,78,LADY MACBETH,1533-0.txt,2235,You look but on a stool.
III,IV,79,MACBETH,1533-0.txt,2238,"Pr’ythee, see there!"
III,IV,80,MACBETH,1533-0.txt,2239,Behold! look! lo! how say you?
III,IV,81,MACBETH,1533-0.txt,2240,"Why, what care I? If thou canst nod, speak too.— "
III,IV,82,MACBETH,1533-0.txt,2241,If charnel houses and our graves must send
III,IV,83,MACBETH,1533-0.txt,2242,"Those that we bury back, our monuments"
III,IV,84,MACBETH,1533-0.txt,2243,Shall be the maws of kites.
III,IV,84,---,1533-0.txt,2245,[Ghost disappears.]
III,IV,85,LADY MACBETH,1533-0.txt,2248,"What, quite unmann’d in folly?"
III,IV,86,MACBETH,1533-0.txt,2251,"If I stand here, I saw him."
III,IV,87,LADY MACBETH,1533-0.txt,2254,"Fie, for shame!"
III,IV,88,MACBETH,1533-0.txt,2257,"Blood hath been shed ere now, i’ th’ olden time,"
III,IV,89,MACBETH,1533-0.txt,2258,Ere humane statute purg’d the gentle weal;
III,IV,90,MACBETH,1533-0.txt,2259,"Ay, and since too, murders have been perform’d"
III,IV,91,MACBETH,1533-0.txt,2260,"Too terrible for the ear: the time has been,"
III,IV,92,MACBETH,1533-0.txt,2261,"That, when the brains were out, the man would die,"
III,IV,93,MACBETH,1533-0.txt,2262,"And there an end; but now they rise again,"
III,IV,94,MACBETH,1533-0.txt,2263,"With twenty mortal murders on their crowns,"
III,IV,95,MACBETH,1533-0.txt,2264,And push us from our stools. This is more strange
III,IV,96,MACBETH,1533-0.txt,2265,Than such a murder is.
III,IV,97,LADY MACBETH,1533-0.txt,2268,"My worthy lord,"
III,IV,98,LADY MACBETH,1533-0.txt,2269,Your noble friends do lack you.
III,IV,99,MACBETH,1533-0.txt,2272,I do forget.— 
III,IV,100,MACBETH,1533-0.txt,2273,"Do not muse at me, my most worthy friends."
III,IV,101,MACBETH,1533-0.txt,2274,"I have a strange infirmity, which is nothing"
III,IV,102,MACBETH,1533-0.txt,2275,"To those that know me. Come, love and health to all;"
III,IV,103,MACBETH,1533-0.txt,2276,"Then I’ll sit down.— Give me some wine, fill full.— "
III,IV,104,MACBETH,1533-0.txt,2277,"I drink to the general joy o’ th’ whole table,"
III,IV,105,MACBETH,1533-0.txt,2278,"And to our dear friend Banquo, whom we miss:"
III,IV,106,MACBETH,1533-0.txt,2279,Would he were here.
III,IV,106,---,1533-0.txt,2281,Ghost rises again.
III,IV,107,MACBETH,1533-0.txt,2283,"To all, and him, we thirst,"
III,IV,108,MACBETH,1533-0.txt,2284,And all to all.
III,IV,109,LORDS,1533-0.txt,2287,"Our duties, and the pledge."
III,IV,110,MACBETH,1533-0.txt,2290,Avaunt! and quit my sight! let the earth hide thee!
III,IV,111,MACBETH,1533-0.txt,2291,"Thy bones are marrowless, thy blood is cold;"
III,IV,112,MACBETH,1533-0.txt,2292,Thou hast no speculation in those eyes
III,IV,113,MACBETH,1533-0.txt,2293,Which thou dost glare with!
III,IV,114,LADY MACBETH,1533-0.txt,2296,"Think of this, good peers,"
III,IV,115,LADY MACBETH,1533-0.txt,2297,"But as a thing of custom: ’tis no other,"
III,IV,116,LADY MACBETH,1533-0.txt,2298,Only it spoils the pleasure of the time.
III,IV,117,MACBETH,1533-0.txt,2301,"What man dare, I dare:"
III,IV,118,MACBETH,1533-0.txt,2302,"Approach thou like the rugged Russian bear,"
III,IV,119,MACBETH,1533-0.txt,2303,"The arm’d rhinoceros, or th’ Hyrcan tiger;"
III,IV,120,MACBETH,1533-0.txt,2304,"Take any shape but that, and my firm nerves"
III,IV,121,MACBETH,1533-0.txt,2305,"Shall never tremble: or be alive again,"
III,IV,122,MACBETH,1533-0.txt,2306,And dare me to the desert with thy sword;
III,IV,123,MACBETH,1533-0.txt,2307,"If trembling I inhabit then, protest me"
III,IV,124,MACBETH,1533-0.txt,2308,"The baby of a girl. Hence, horrible shadow!"
III,IV,125,MACBETH,1533-0.txt,2309,"Unreal mock’ry, hence!"
III,IV,125,---,1533-0.txt,2311,[Ghost disappears.]
III,IV,126,MACBETH,1533-0.txt,2313,"Why, so;— being gone,"
III,IV,127,MACBETH,1533-0.txt,2314,"I am a man again.— Pray you, sit still."
III,IV,128,LADY MACBETH,1533-0.txt,2317,"You have displaced the mirth, broke the good meeting"
III,IV,129,LADY MACBETH,1533-0.txt,2318,With most admir’d disorder.
III,IV,130,MACBETH,1533-0.txt,2321,"Can such things be,"
III,IV,131,MACBETH,1533-0.txt,2322,"And overcome us like a summer’s cloud,"
III,IV,132,MACBETH,1533-0.txt,2323,Without our special wonder? You make me strange
III,IV,133,MACBETH,1533-0.txt,2324,"Even to the disposition that I owe,"
III,IV,134,MACBETH,1533-0.txt,2325,"When now I think you can behold such sights,"
III,IV,135,MACBETH,1533-0.txt,2326,"And keep the natural ruby of your cheeks,"
III,IV,136,MACBETH,1533-0.txt,2327,When mine are blanch’d with fear.
III,IV,137,ROSS,1533-0.txt,2330,"What sights, my lord?"
III,IV,138,LADY MACBETH,1533-0.txt,2333,"I pray you, speak not; he grows worse and worse;"
III,IV,139,LADY MACBETH,1533-0.txt,2334,"Question enrages him. At once, good night:— "
III,IV,140,LADY MACBETH,1533-0.txt,2335,"Stand not upon the order of your going,"
III,IV,141,LADY MACBETH,1533-0.txt,2336,But go at once.
III,IV,142,LENNOX,1533-0.txt,2339,Good night; and better health
III,IV,143,LENNOX,1533-0.txt,2340,Attend his Majesty!
III,IV,144,LADY MACBETH,1533-0.txt,2343,A kind good night to all!
III,IV,144,---,1533-0.txt,2345,[Exeunt all Lords and Atendants.]
III,IV,145,MACBETH,1533-0.txt,2348,"It will have blood, they say, blood will have blood."
III,IV,146,MACBETH,1533-0.txt,2349,"Stones have been known to move, and trees to speak;"
III,IV,147,MACBETH,1533-0.txt,2350,"Augurs, and understood relations, have"
III,IV,148,MACBETH,1533-0.txt,2351,"By magot-pies, and choughs, and rooks, brought forth"
III,IV,149,MACBETH,1533-0.txt,2352,The secret’st man of blood.— What is the night?
III,IV,150,LADY MACBETH,1533-0.txt,2355,"Almost at odds with morning, which is which."
III,IV,151,MACBETH,1533-0.txt,2358,"How say’st thou, that Macduff denies his person"
III,IV,152,MACBETH,1533-0.txt,2359,At our great bidding?
III,IV,153,LADY MACBETH,1533-0.txt,2362,"Did you send to him, sir?"
III,IV,154,MACBETH,1533-0.txt,2365,I hear it by the way; but I will send.
III,IV,155,MACBETH,1533-0.txt,2366,There’s not a one of them but in his house
III,IV,156,MACBETH,1533-0.txt,2367,I keep a servant fee’d. I will tomorrow
III,IV,157,MACBETH,1533-0.txt,2368,(And betimes I will) to the Weird Sisters:
III,IV,158,MACBETH,1533-0.txt,2369,"More shall they speak; for now I am bent to know,"
III,IV,159,MACBETH,1533-0.txt,2370,"By the worst means, the worst. For mine own good,"
III,IV,160,MACBETH,1533-0.txt,2371,All causes shall give way: I am in blood
III,IV,161,MACBETH,1533-0.txt,2372,"Stepp’d in so far that, should I wade no more,"
III,IV,162,MACBETH,1533-0.txt,2373,Returning were as tedious as go o’er.
III,IV,163,MACBETH,1533-0.txt,2374,"Strange things I have in head, that will to hand,"
III,IV,164,MACBETH,1533-0.txt,2375,Which must be acted ere they may be scann’d.
III,IV,165,LADY MACBETH,1533-0.txt,2378,"You lack the season of all natures, sleep."
III,IV,166,MACBETH,1533-0.txt,2381,"Come, we’ll to sleep. My strange and self-abuse"
III,IV,167,MACBETH,1533-0.txt,2382,Is the initiate fear that wants hard use.
III,IV,168,MACBETH,1533-0.txt,2383,We are yet but young in deed.
III,IV,168,---,1533-0.txt,2385,[Exeunt.]
III,V,0,---,1533-0.txt,2389,Thunder. Enter the three Witches meeting Hecate.
III,V,1,FIRST WITCH,1533-0.txt,2392,"Why, how now, Hecate? you look angerly."
III,V,2,HECATE,1533-0.txt,2395,"Have I not reason, beldams as you are,"
III,V,3,HECATE,1533-0.txt,2396,Saucy and overbold? How did you dare
III,V,4,HECATE,1533-0.txt,2397,To trade and traffic with Macbeth
III,V,5,HECATE,1533-0.txt,2398,In riddles and affairs of death;
III,V,6,HECATE,1533-0.txt,2399,"And I, the mistress of your charms,"
III,V,7,HECATE,1533-0.txt,2400,"The close contriver of all harms,"
III,V,8,HECATE,1533-0.txt,2401,"Was never call’d to bear my part,"
III,V,9,HECATE,1533-0.txt,2402,Or show the glory of our art?
III,V,10,HECATE,1533-0.txt,2403,"And, which is worse, all you have done"
III,V,11,HECATE,1533-0.txt,2404,"Hath been but for a wayward son,"
III,V,12,HECATE,1533-0.txt,2405,"Spiteful and wrathful; who, as others do,"
III,V,13,HECATE,1533-0.txt,2406,"Loves for his own ends, not for you."
III,V,14,HECATE,1533-0.txt,2407,"But make amends now: get you gone,"
III,V,15,HECATE,1533-0.txt,2408,And at the pit of Acheron
III,V,16,HECATE,1533-0.txt,2409,Meet me i’ th’ morning: thither he
III,V,17,HECATE,1533-0.txt,2410,Will come to know his destiny.
III,V,18,HECATE,1533-0.txt,2411,"Your vessels and your spells provide,"
III,V,19,HECATE,1533-0.txt,2412,"Your charms, and everything beside."
III,V,20,HECATE,1533-0.txt,2413,I am for th’ air; this night I’ll spend
III,V,21,HECATE,1533-0.txt,2414,Unto a dismal and a fatal end.
III,V,22,HECATE,1533-0.txt,2415,Great business must be wrought ere noon.
III,V,23,HECATE,1533-0.txt,2416,Upon the corner of the moon
III,V,24,HECATE,1533-0.txt,2417,There hangs a vap’rous drop profound;
