act,scene,scene_line,role,file_name,file_lineno,line
III,V,25,HECATE,1533-0.txt,2418,I’ll catch it ere it come to ground:
III,V,26,HECATE,1533-0.txt,2419,"And that, distill’d by magic sleights,"
III,V,27,HECATE,1533-0.txt,2420,"Shall raise such artificial sprites,"
III,V,28,HECATE,1533-0.txt,2421,"As, by the strength of their illusion,"
III,V,29,HECATE,1533-0.txt,2422,Shall draw him on to his confusion.
III,V,30,HECATE,1533-0.txt,2423,"He shall spurn fate, scorn death, and bear"
III,V,31,HECATE,1533-0.txt,2424,"His hopes ’bove wisdom, grace, and fear."
III,V,32,HECATE,1533-0.txt,2425,"And you all know, security"
III,V,33,HECATE,1533-0.txt,2426,Is mortals’ chiefest enemy.
III,V,33,---,1533-0.txt,2428,"[Music and song within, “Come away, come away” &c.]"
III,V,34,HECATE,1533-0.txt,2430,"Hark! I am call’d; my little spirit, see,"
III,V,35,HECATE,1533-0.txt,2431,Sits in a foggy cloud and stays for me.
III,V,35,---,1533-0.txt,2433,[Exit.]
III,V,36,FIRST WITCH,1533-0.txt,2436,"Come, let’s make haste; she’ll soon be back again."
III,V,36,---,1533-0.txt,2438,[Exeunt.]
III,VI,0,---,1533-0.txt,2442,Enter Lennox and another Lord.
III,VI,1,LENNOX,1533-0.txt,2445,"My former speeches have but hit your thoughts,"
III,VI,2,LENNOX,1533-0.txt,2446,"Which can interpret farther: only, I say,"
III,VI,3,LENNOX,1533-0.txt,2447,Thing’s have been strangely borne. The gracious Duncan
III,VI,4,LENNOX,1533-0.txt,2448,"Was pitied of Macbeth:— marry, he was dead:— "
III,VI,5,LENNOX,1533-0.txt,2449,And the right valiant Banquo walk’d too late;
III,VI,6,LENNOX,1533-0.txt,2450,"Whom, you may say, if’t please you, Fleance kill’d,"
III,VI,7,LENNOX,1533-0.txt,2451,For Fleance fled. Men must not walk too late.
III,VI,8,LENNOX,1533-0.txt,2452,"Who cannot want the thought, how monstrous"
III,VI,9,LENNOX,1533-0.txt,2453,It was for Malcolm and for Donalbain
III,VI,10,LENNOX,1533-0.txt,2454,To kill their gracious father? damned fact!
III,VI,11,LENNOX,1533-0.txt,2455,"How it did grieve Macbeth! did he not straight,"
III,VI,12,LENNOX,1533-0.txt,2456,"In pious rage, the two delinquents tear"
III,VI,13,LENNOX,1533-0.txt,2457,That were the slaves of drink and thralls of sleep?
III,VI,14,LENNOX,1533-0.txt,2458,"Was not that nobly done? Ay, and wisely too;"
III,VI,15,LENNOX,1533-0.txt,2459,"For ’twould have anger’d any heart alive,"
III,VI,16,LENNOX,1533-0.txt,2460,"To hear the men deny’t. So that, I say,"
III,VI,17,LENNOX,1533-0.txt,2461,"He has borne all things well: and I do think,"
III,VI,18,LENNOX,1533-0.txt,2462,That had he Duncan’s sons under his key
III,VI,19,LENNOX,1533-0.txt,2463,"(As, and’t please heaven, he shall not) they should find"
III,VI,20,LENNOX,1533-0.txt,2464,What ’twere to kill a father; so should Fleance.
III,VI,21,LENNOX,1533-0.txt,2465,"But, peace!— for from broad words, and ’cause he fail’d"
III,VI,22,LENNOX,1533-0.txt,2466,"His presence at the tyrant’s feast, I hear,"
III,VI,23,LENNOX,1533-0.txt,2467,"Macduff lives in disgrace. Sir, can you tell"
III,VI,24,LENNOX,1533-0.txt,2468,Where he bestows himself?
III,VI,25,LORD,1533-0.txt,2471,"The son of Duncan,"
III,VI,26,LORD,1533-0.txt,2472,"From whom this tyrant holds the due of birth,"
III,VI,27,LORD,1533-0.txt,2473,Lives in the English court and is receiv’d
III,VI,28,LORD,1533-0.txt,2474,Of the most pious Edward with such grace
III,VI,29,LORD,1533-0.txt,2475,That the malevolence of fortune nothing
III,VI,30,LORD,1533-0.txt,2476,Takes from his high respect. Thither Macduff
III,VI,31,LORD,1533-0.txt,2477,"Is gone to pray the holy king, upon his aid"
III,VI,32,LORD,1533-0.txt,2478,"To wake Northumberland, and warlike Siward"
III,VI,33,LORD,1533-0.txt,2479,"That, by the help of these (with Him above"
III,VI,34,LORD,1533-0.txt,2480,"To ratify the work), we may again"
III,VI,35,LORD,1533-0.txt,2481,"Give to our tables meat, sleep to our nights;"
III,VI,36,LORD,1533-0.txt,2482,"Free from our feasts and banquets bloody knives,"
III,VI,37,LORD,1533-0.txt,2483,"Do faithful homage, and receive free honours,"
III,VI,38,LORD,1533-0.txt,2484,All which we pine for now. And this report
III,VI,39,LORD,1533-0.txt,2485,Hath so exasperate the King that he
III,VI,40,LORD,1533-0.txt,2486,Prepares for some attempt of war.
III,VI,41,LENNOX,1533-0.txt,2489,Sent he to Macduff?
III,VI,42,LORD,1533-0.txt,2492,"He did: and with an absolute “Sir, not I,”"
III,VI,43,LORD,1533-0.txt,2493,"The cloudy messenger turns me his back,"
III,VI,44,LORD,1533-0.txt,2494,"And hums, as who should say, “You’ll rue the time"
III,VI,45,LORD,1533-0.txt,2495,That clogs me with this answer.”
III,VI,46,LENNOX,1533-0.txt,2498,And that well might
III,VI,47,LENNOX,1533-0.txt,2499,"Advise him to a caution, t’ hold what distance"
III,VI,48,LENNOX,1533-0.txt,2500,His wisdom can provide. Some holy angel
III,VI,49,LENNOX,1533-0.txt,2501,"Fly to the court of England, and unfold"
III,VI,50,LENNOX,1533-0.txt,2502,"His message ere he come, that a swift blessing"
III,VI,51,LENNOX,1533-0.txt,2503,May soon return to this our suffering country
III,VI,52,LENNOX,1533-0.txt,2504,Under a hand accurs’d!
III,VI,53,LORD,1533-0.txt,2507,I’ll send my prayers with him.
III,VI,53,---,1533-0.txt,2509,[Exeunt.]
IV,I,0,---,1533-0.txt,2516,Thunder. Enter the three Witches.
IV,I,1,FIRST WITCH,1533-0.txt,2519,Thrice the brinded cat hath mew’d.
IV,I,2,SECOND WITCH,1533-0.txt,2522,"Thrice, and once the hedge-pig whin’d."
IV,I,3,THIRD WITCH,1533-0.txt,2525,"Harpier cries:— ’Tis time, ’tis time."
IV,I,4,FIRST WITCH,1533-0.txt,2528,Round about the cauldron go;
IV,I,5,FIRST WITCH,1533-0.txt,2529,In the poison’d entrails throw.— 
IV,I,6,FIRST WITCH,1533-0.txt,2530,"Toad, that under cold stone"
IV,I,7,FIRST WITCH,1533-0.txt,2531,Days and nights has thirty-one
IV,I,8,FIRST WITCH,1533-0.txt,2532,"Swelter’d venom sleeping got,"
IV,I,9,FIRST WITCH,1533-0.txt,2533,Boil thou first i’ th’ charmed pot!
IV,I,10,ALL,1533-0.txt,2536,"Double, double, toil and trouble;"
IV,I,11,ALL,1533-0.txt,2537,"Fire, burn; and cauldron, bubble."
IV,I,12,SECOND WITCH,1533-0.txt,2540,"Fillet of a fenny snake,"
IV,I,13,SECOND WITCH,1533-0.txt,2541,In the cauldron boil and bake;
IV,I,14,SECOND WITCH,1533-0.txt,2542,"Eye of newt, and toe of frog,"
IV,I,15,SECOND WITCH,1533-0.txt,2543,"Wool of bat, and tongue of dog,"
IV,I,16,SECOND WITCH,1533-0.txt,2544,"Adder’s fork, and blind-worm’s sting,"
IV,I,17,SECOND WITCH,1533-0.txt,2545,"Lizard’s leg, and howlet’s wing,"
IV,I,18,SECOND WITCH,1533-0.txt,2546,"For a charm of powerful trouble,"
IV,I,19,SECOND WITCH,1533-0.txt,2547,Like a hell-broth boil and bubble.
IV,I,20,ALL,1533-0.txt,2550,"Double, double, toil and trouble;"
IV,I,21,ALL,1533-0.txt,2551,"Fire, burn; and cauldron, bubble."
IV,I,22,THIRD WITCH,1533-0.txt,2554,"Scale of dragon, tooth of wolf,"
IV,I,23,THIRD WITCH,1533-0.txt,2555,"Witch’s mummy, maw and gulf"
IV,I,24,THIRD WITCH,1533-0.txt,2556,"Of the ravin’d salt-sea shark,"
IV,I,25,THIRD WITCH,1533-0.txt,2557,"Root of hemlock digg’d i’ th’ dark,"
IV,I,26,THIRD WITCH,1533-0.txt,2558,"Liver of blaspheming Jew,"
IV,I,27,THIRD WITCH,1533-0.txt,2559,"Gall of goat, and slips of yew"
IV,I,28,THIRD WITCH,1533-0.txt,2560,"Sliver’d in the moon’s eclipse,"
IV,I,29,THIRD WITCH,1533-0.txt,2561,"Nose of Turk, and Tartar’s lips,"
IV,I,30,THIRD WITCH,1533-0.txt,2562,Finger of birth-strangled babe
IV,I,31,THIRD WITCH,1533-0.txt,2563,"Ditch-deliver’d by a drab,"
IV,I,32,THIRD WITCH,1533-0.txt,2564,Make the gruel thick and slab:
IV,I,33,THIRD WITCH,1533-0.txt,2565,"Add thereto a tiger’s chaudron,"
IV,I,34,THIRD WITCH,1533-0.txt,2566,For th’ ingredients of our cauldron.
IV,I,35,ALL,1533-0.txt,2569,"Double, double, toil and trouble;"
IV,I,36,ALL,1533-0.txt,2570,"Fire, burn; and cauldron, bubble."
IV,I,37,SECOND WITCH,1533-0.txt,2573,Cool it with a baboon’s blood.
IV,I,38,SECOND WITCH,1533-0.txt,2574,Then the charm is firm and good.
IV,I,38,---,1533-0.txt,2576,Enter Hecate.
IV,I,39,HECATE,1533-0.txt,2579,"O, well done! I commend your pains,"
IV,I,40,HECATE,1533-0.txt,2580,And everyone shall share i’ th’ gains.
IV,I,41,HECATE,1533-0.txt,2581,"And now about the cauldron sing,"
IV,I,42,HECATE,1533-0.txt,2582,"Like elves and fairies in a ring,"
IV,I,43,HECATE,1533-0.txt,2583,Enchanting all that you put in.
IV,I,43,---,1533-0.txt,2585,"[Music and a song: “Black Spirits,” &c.]"
IV,I,43,---,1533-0.txt,2587,[Exit Hecate.]
IV,I,44,SECOND WITCH,1533-0.txt,2590,"By the pricking of my thumbs,"
IV,I,45,SECOND WITCH,1533-0.txt,2591,Something wicked this way comes.
IV,I,46,SECOND WITCH,1533-0.txt,2592,"Open, locks,"
IV,I,47,SECOND WITCH,1533-0.txt,2593,Whoever knocks!
IV,I,47,---,1533-0.txt,2595,Enter Macbeth.
IV,I,48,MACBETH,1533-0.txt,2598,"How now, you secret, black, and midnight hags!"
IV,I,49,MACBETH,1533-0.txt,2599,What is’t you do?
IV,I,50,ALL,1533-0.txt,2602,A deed without a name.
IV,I,51,MACBETH,1533-0.txt,2605,"I conjure you, by that which you profess,"
IV,I,52,MACBETH,1533-0.txt,2606,(Howe’er you come to know it) answer me:
IV,I,53,MACBETH,1533-0.txt,2607,"Though you untie the winds, and let them fight"
IV,I,54,MACBETH,1533-0.txt,2608,Against the churches; though the yesty waves
IV,I,55,MACBETH,1533-0.txt,2609,Confound and swallow navigation up;
IV,I,56,MACBETH,1533-0.txt,2610,"Though bladed corn be lodg’d, and trees blown down;"
IV,I,57,MACBETH,1533-0.txt,2611,Though castles topple on their warders’ heads;
IV,I,58,MACBETH,1533-0.txt,2612,Though palaces and pyramids do slope
IV,I,59,MACBETH,1533-0.txt,2613,Their heads to their foundations; though the treasure
IV,I,60,MACBETH,1533-0.txt,2614,"Of nature’s germens tumble all together,"
IV,I,61,MACBETH,1533-0.txt,2615,"Even till destruction sicken, answer me"
IV,I,62,MACBETH,1533-0.txt,2616,To what I ask you.
IV,I,63,FIRST WITCH,1533-0.txt,2619,Speak.
IV,I,64,SECOND WITCH,1533-0.txt,2622,Demand.
IV,I,65,THIRD WITCH,1533-0.txt,2625,We’ll answer.
IV,I,66,FIRST WITCH,1533-0.txt,2628,"Say, if thou’dst rather hear it from our mouths,"
IV,I,67,FIRST WITCH,1533-0.txt,2629,Or from our masters?
IV,I,68,MACBETH,1533-0.txt,2632,"Call ’em, let me see ’em."
IV,I,69,FIRST WITCH,1533-0.txt,2635,"Pour in sow’s blood, that hath eaten"
IV,I,70,FIRST WITCH,1533-0.txt,2636,Her nine farrow; grease that’s sweaten
IV,I,71,FIRST WITCH,1533-0.txt,2637,From the murderer’s gibbet throw
IV,I,72,FIRST WITCH,1533-0.txt,2638,Into the flame.
IV,I,73,ALL,1533-0.txt,2641,"Come, high or low;"
IV,I,74,ALL,1533-0.txt,2642,Thyself and office deftly show!
IV,I,74,---,1533-0.txt,2644,[Thunder. An Apparition of an armed Head rises.]
IV,I,75,MACBETH,1533-0.txt,2647,"Tell me, thou unknown power,— "
IV,I,76,FIRST WITCH,1533-0.txt,2650,He knows thy thought:
IV,I,77,FIRST WITCH,1533-0.txt,2651,"Hear his speech, but say thou naught."
IV,I,78,APPARITION,1533-0.txt,2654,Macbeth! Macbeth! Macbeth! Beware Macduff;
IV,I,79,APPARITION,1533-0.txt,2655,Beware the Thane of Fife.— Dismiss me.— Enough.
IV,I,79,---,1533-0.txt,2657,[Descends.]
IV,I,80,MACBETH,1533-0.txt,2660,"Whate’er thou art, for thy good caution, thanks;"
IV,I,81,MACBETH,1533-0.txt,2661,Thou hast harp’d my fear aright.— But one word more.
IV,I,82,FIRST WITCH,1533-0.txt,2664,"He will not be commanded. Here’s another,"
IV,I,83,FIRST WITCH,1533-0.txt,2665,More potent than the first.
IV,I,83,---,1533-0.txt,2667,[Thunder. An Apparition of a bloody Child rises.]
IV,I,84,APPARITION,1533-0.txt,2670,Macbeth! Macbeth! Macbeth!
IV,I,85,MACBETH,1533-0.txt,2673,"Had I three ears, I’d hear thee."
IV,I,86,APPARITION,1533-0.txt,2676,"Be bloody, bold, and resolute. Laugh to scorn"
IV,I,87,APPARITION,1533-0.txt,2677,"The power of man, for none of woman born"
IV,I,88,APPARITION,1533-0.txt,2678,Shall harm Macbeth.
IV,I,88,---,1533-0.txt,2680,[Descends.]
IV,I,89,MACBETH,1533-0.txt,2683,"Then live, Macduff: what need I fear of thee?"
IV,I,90,MACBETH,1533-0.txt,2684,"But yet I’ll make assurance double sure,"
IV,I,91,MACBETH,1533-0.txt,2685,And take a bond of fate. Thou shalt not live;
IV,I,92,MACBETH,1533-0.txt,2686,"That I may tell pale-hearted fear it lies,"
IV,I,93,MACBETH,1533-0.txt,2687,And sleep in spite of thunder.
IV,I,93,---,1533-0.txt,2689,"[Thunder. An Apparition of a Child crowned, with a tree in his hand, rises.]"
IV,I,94,MACBETH,1533-0.txt,2692,"What is this,"
IV,I,95,MACBETH,1533-0.txt,2693,"That rises like the issue of a king,"
IV,I,96,MACBETH,1533-0.txt,2694,And wears upon his baby brow the round
IV,I,97,MACBETH,1533-0.txt,2695,And top of sovereignty?
IV,I,98,ALL,1533-0.txt,2698,"Listen, but speak not to’t."
IV,I,99,APPARITION,1533-0.txt,2701,"Be lion-mettled, proud, and take no care"
IV,I,100,APPARITION,1533-0.txt,2702,"Who chafes, who frets, or where conspirers are:"
IV,I,101,APPARITION,1533-0.txt,2703,"Macbeth shall never vanquish’d be, until"
IV,I,102,APPARITION,1533-0.txt,2704,Great Birnam wood to high Dunsinane hill
IV,I,103,APPARITION,1533-0.txt,2705,Shall come against him.
IV,I,103,---,1533-0.txt,2707,[Descends.]
IV,I,104,MACBETH,1533-0.txt,2710,That will never be:
IV,I,105,MACBETH,1533-0.txt,2711,Who can impress the forest; bid the tree
IV,I,106,MACBETH,1533-0.txt,2712,"Unfix his earth-bound root? Sweet bodements, good!"
IV,I,107,MACBETH,1533-0.txt,2713,"Rebellious head, rise never till the wood"
IV,I,108,MACBETH,1533-0.txt,2714,"Of Birnam rise, and our high-plac’d Macbeth"
IV,I,109,MACBETH,1533-0.txt,2715,"Shall live the lease of nature, pay his breath"
IV,I,110,MACBETH,1533-0.txt,2716,To time and mortal custom.— Yet my heart
IV,I,111,MACBETH,1533-0.txt,2717,"Throbs to know one thing: tell me, if your art"
IV,I,112,MACBETH,1533-0.txt,2718,"Can tell so much, shall Banquo’s issue ever"
IV,I,113,MACBETH,1533-0.txt,2719,Reign in this kingdom?
IV,I,114,ALL,1533-0.txt,2722,Seek to know no more.
IV,I,115,MACBETH,1533-0.txt,2725,"I will be satisfied: deny me this,"
IV,I,116,MACBETH,1533-0.txt,2726,And an eternal curse fall on you! Let me know.
IV,I,117,MACBETH,1533-0.txt,2727,Why sinks that cauldron? and what noise is this?
IV,I,117,---,1533-0.txt,2729,[Hautboys.]
IV,I,118,FIRST WITCH,1533-0.txt,2732,Show!
IV,I,119,SECOND WITCH,1533-0.txt,2735,Show!
IV,I,120,THIRD WITCH,1533-0.txt,2738,Show!
IV,I,121,ALL,1533-0.txt,2741,"Show his eyes, and grieve his heart;"
IV,I,122,ALL,1533-0.txt,2742,"Come like shadows, so depart!"
IV,I,122,---,1533-0.txt,2744,"[A show of eight kings appear, and pass over in order, the last with a glass in his hand; Banquo following.]"
IV,I,123,MACBETH,1533-0.txt,2748,Thou are too like the spirit of Banquo. Down!
IV,I,124,MACBETH,1533-0.txt,2749,"Thy crown does sear mine eyeballs:— and thy hair,"
IV,I,125,MACBETH,1533-0.txt,2750,"Thou other gold-bound brow, is like the first."
IV,I,126,MACBETH,1533-0.txt,2751,A third is like the former.— Filthy hags!
IV,I,127,MACBETH,1533-0.txt,2752,"Why do you show me this?— A fourth!— Start, eyes!"
IV,I,128,MACBETH,1533-0.txt,2753,"What, will the line stretch out to th’ crack of doom?"
IV,I,129,MACBETH,1533-0.txt,2754,Another yet!— A seventh!— I’ll see no more:— 
IV,I,130,MACBETH,1533-0.txt,2755,"And yet the eighth appears, who bears a glass"
IV,I,131,MACBETH,1533-0.txt,2756,Which shows me many more; and some I see
IV,I,132,MACBETH,1533-0.txt,2757,That twofold balls and treble sceptres carry.
IV,I,133,MACBETH,1533-0.txt,2758,Horrible sight!— Now I see ’tis true;
IV,I,134,MACBETH,1533-0.txt,2759,"For the blood-bolter’d Banquo smiles upon me,"
IV,I,135,MACBETH,1533-0.txt,2760,And points at them for his.— What! is this so?
IV,I,136,FIRST WITCH,1533-0.txt,2763,"Ay, sir, all this is so:— but why"
IV,I,137,FIRST WITCH,1533-0.txt,2764,Stands Macbeth thus amazedly?— 
IV,I,138,FIRST WITCH,1533-0.txt,2765,"Come, sisters, cheer we up his sprites,"
IV,I,139,FIRST WITCH,1533-0.txt,2766,And show the best of our delights.
IV,I,140,FIRST WITCH,1533-0.txt,2767,"I’ll charm the air to give a sound,"
IV,I,141,FIRST WITCH,1533-0.txt,2768,While you perform your antic round;
IV,I,142,FIRST WITCH,1533-0.txt,2769,"That this great king may kindly say,"
IV,I,143,FIRST WITCH,1533-0.txt,2770,Our duties did his welcome pay.
IV,I,143,---,1533-0.txt,2772,"[Music. The Witches dance, and vanish.]"
IV,I,144,MACBETH,1533-0.txt,2775,Where are they? Gone?— Let this pernicious hour
IV,I,145,MACBETH,1533-0.txt,2776,Stand aye accursed in the calendar!— 
IV,I,146,MACBETH,1533-0.txt,2777,"Come in, without there!"
IV,I,146,---,1533-0.txt,2779,Enter Lennox.
IV,I,147,LENNOX,1533-0.txt,2782,What’s your Grace’s will?
IV,I,148,MACBETH,1533-0.txt,2785,Saw you the Weird Sisters?
IV,I,149,LENNOX,1533-0.txt,2788,"No, my lord."
IV,I,150,MACBETH,1533-0.txt,2791,Came they not by you?
IV,I,151,LENNOX,1533-0.txt,2794,"No, indeed, my lord."
IV,I,152,MACBETH,1533-0.txt,2797,Infected be the air whereon they ride;
IV,I,153,MACBETH,1533-0.txt,2798,And damn’d all those that trust them!— I did hear
IV,I,154,MACBETH,1533-0.txt,2799,The galloping of horse: who was’t came by?
IV,I,155,LENNOX,1533-0.txt,2802,"’Tis two or three, my lord, that bring you word"
IV,I,156,LENNOX,1533-0.txt,2803,Macduff is fled to England.
IV,I,157,MACBETH,1533-0.txt,2806,Fled to England!
IV,I,158,LENNOX,1533-0.txt,2809,"Ay, my good lord."
IV,I,159,MACBETH,1533-0.txt,2812,"Time, thou anticipat’st my dread exploits:"
IV,I,160,MACBETH,1533-0.txt,2813,The flighty purpose never is o’ertook
IV,I,161,MACBETH,1533-0.txt,2814,Unless the deed go with it. From this moment
IV,I,162,MACBETH,1533-0.txt,2815,The very firstlings of my heart shall be
IV,I,163,MACBETH,1533-0.txt,2816,"The firstlings of my hand. And even now,"
IV,I,164,MACBETH,1533-0.txt,2817,"To crown my thoughts with acts, be it thought and done:"
IV,I,165,MACBETH,1533-0.txt,2818,The castle of Macduff I will surprise;
IV,I,166,MACBETH,1533-0.txt,2819,Seize upon Fife; give to th’ edge o’ th’ sword
IV,I,167,MACBETH,1533-0.txt,2820,"His wife, his babes, and all unfortunate souls"
IV,I,168,MACBETH,1533-0.txt,2821,That trace him in his line. No boasting like a fool;
IV,I,169,MACBETH,1533-0.txt,2822,This deed I’ll do before this purpose cool:
IV,I,170,MACBETH,1533-0.txt,2823,But no more sights!— Where are these gentlemen?
IV,I,171,MACBETH,1533-0.txt,2824,"Come, bring me where they are."
IV,I,171,---,1533-0.txt,2826,[Exeunt.]
IV,II,0,---,1533-0.txt,2830,Enter Lady Macduff her Son and Ross.
IV,II,1,LADY MACDUFF,1533-0.txt,2833,"What had he done, to make him fly the land?"
IV,II,2,ROSS,1533-0.txt,2836,"You must have patience, madam."
IV,II,3,LADY MACDUFF,1533-0.txt,2839,He had none:
IV,II,4,LADY MACDUFF,1533-0.txt,2840,"His flight was madness: when our actions do not,"
IV,II,5,LADY MACDUFF,1533-0.txt,2841,Our fears do make us traitors.
IV,II,6,ROSS,1533-0.txt,2844,You know not
IV,II,7,ROSS,1533-0.txt,2845,Whether it was his wisdom or his fear.
IV,II,8,LADY MACDUFF,1533-0.txt,2848,"Wisdom! to leave his wife, to leave his babes,"
IV,II,9,LADY MACDUFF,1533-0.txt,2849,"His mansion, and his titles, in a place"
IV,II,10,LADY MACDUFF,1533-0.txt,2850,From whence himself does fly? He loves us not:
IV,II,11,LADY MACDUFF,1533-0.txt,2851,"He wants the natural touch; for the poor wren,"
IV,II,12,LADY MACDUFF,1533-0.txt,2852,"The most diminutive of birds, will fight,"
IV,II,13,LADY MACDUFF,1533-0.txt,2853,"Her young ones in her nest, against the owl."
IV,II,14,LADY MACDUFF,1533-0.txt,2854,"All is the fear, and nothing is the love;"
IV,II,15,LADY MACDUFF,1533-0.txt,2855,"As little is the wisdom, where the flight"
IV,II,16,LADY MACDUFF,1533-0.txt,2856,So runs against all reason.
IV,II,17,ROSS,1533-0.txt,2859,"My dearest coz,"
IV,II,18,ROSS,1533-0.txt,2860,"I pray you, school yourself: but, for your husband,"
IV,II,19,ROSS,1533-0.txt,2861,"He is noble, wise, judicious, and best knows"
IV,II,20,ROSS,1533-0.txt,2862,The fits o’ th’ season. I dare not speak much further:
IV,II,21,ROSS,1533-0.txt,2863,"But cruel are the times, when we are traitors,"
IV,II,22,ROSS,1533-0.txt,2864,And do not know ourselves; when we hold rumour
IV,II,23,ROSS,1533-0.txt,2865,"From what we fear, yet know not what we fear,"
IV,II,24,ROSS,1533-0.txt,2866,But float upon a wild and violent sea
IV,II,25,ROSS,1533-0.txt,2867,Each way and move— I take my leave of you:
IV,II,26,ROSS,1533-0.txt,2868,Shall not be long but I’ll be here again.
IV,II,27,ROSS,1533-0.txt,2869,"Things at the worst will cease, or else climb upward"
IV,II,28,ROSS,1533-0.txt,2870,"To what they were before.— My pretty cousin,"
IV,II,29,ROSS,1533-0.txt,2871,Blessing upon you!
IV,II,30,LADY MACDUFF,1533-0.txt,2874,"Father’d he is, and yet he’s fatherless."
IV,II,31,ROSS,1533-0.txt,2877,"I am so much a fool, should I stay longer,"
IV,II,32,ROSS,1533-0.txt,2878,It would be my disgrace and your discomfort:
IV,II,33,ROSS,1533-0.txt,2879,I take my leave at once.
IV,II,33,---,1533-0.txt,2881,[Exit.]
IV,II,34,LADY MACDUFF,1533-0.txt,2884,"Sirrah, your father’s dead."
IV,II,35,LADY MACDUFF,1533-0.txt,2885,And what will you do now? How will you live?
IV,II,36,SON,1533-0.txt,2888,"As birds do, mother."
IV,II,37,LADY MACDUFF,1533-0.txt,2891,"What, with worms and flies?"
IV,II,38,SON,1533-0.txt,2894,"With what I get, I mean; and so do they."
IV,II,39,LADY MACDUFF,1533-0.txt,2897,"Poor bird! thou’dst never fear the net nor lime,"
IV,II,40,LADY MACDUFF,1533-0.txt,2898,The pit-fall nor the gin.
IV,II,41,SON,1533-0.txt,2901,"Why should I, mother? Poor birds they are not set for."
IV,II,42,SON,1533-0.txt,2902,"My father is not dead, for all your saying."
IV,II,43,LADY MACDUFF,1533-0.txt,2905,"Yes, he is dead: how wilt thou do for a father?"
IV,II,44,SON,1533-0.txt,2908,"Nay, how will you do for a husband?"
IV,II,45,LADY MACDUFF,1533-0.txt,2911,"Why, I can buy me twenty at any market."
IV,II,46,SON,1533-0.txt,2914,Then you’ll buy ’em to sell again.
IV,II,47,LADY MACDUFF,1533-0.txt,2917,Thou speak’st with all thy wit;
IV,II,48,LADY MACDUFF,1533-0.txt,2918,"And yet, i’ faith, with wit enough for thee."
IV,II,49,SON,1533-0.txt,2921,"Was my father a traitor, mother?"
IV,II,50,LADY MACDUFF,1533-0.txt,2924,"Ay, that he was."
IV,II,51,SON,1533-0.txt,2927,What is a traitor?
IV,II,52,LADY MACDUFF,1533-0.txt,2930,"Why, one that swears and lies."
IV,II,53,SON,1533-0.txt,2933,And be all traitors that do so?
IV,II,54,LADY MACDUFF,1533-0.txt,2936,"Every one that does so is a traitor, and must be hanged."
IV,II,55,SON,1533-0.txt,2939,And must they all be hanged that swear and lie?
IV,II,56,LADY MACDUFF,1533-0.txt,2942,Every one.
IV,II,57,SON,1533-0.txt,2945,Who must hang them?
IV,II,58,LADY MACDUFF,1533-0.txt,2948,"Why, the honest men."
IV,II,59,SON,1533-0.txt,2951,Then the liars and swearers are fools: for there are liars and swearers
IV,II,60,SON,1533-0.txt,2952,enow to beat the honest men and hang up them.
IV,II,61,LADY MACDUFF,1533-0.txt,2955,"Now, God help thee, poor monkey! But how wilt thou do for a father?"
IV,II,62,SON,1533-0.txt,2958,"If he were dead, you’ld weep for him: if you would not, it were a good"
IV,II,63,SON,1533-0.txt,2959,sign that I should quickly have a new father.
IV,II,64,LADY MACDUFF,1533-0.txt,2962,"Poor prattler, how thou talk’st!"
IV,II,64,---,1533-0.txt,2964,Enter a Messenger.
IV,II,65,MESSENGER,1533-0.txt,2967,"Bless you, fair dame! I am not to you known,"
IV,II,66,MESSENGER,1533-0.txt,2968,Though in your state of honour I am perfect.
IV,II,67,MESSENGER,1533-0.txt,2969,I doubt some danger does approach you nearly:
IV,II,68,MESSENGER,1533-0.txt,2970,"If you will take a homely man’s advice,"
IV,II,69,MESSENGER,1533-0.txt,2971,"Be not found here; hence, with your little ones."
IV,II,70,MESSENGER,1533-0.txt,2972,"To fright you thus, methinks, I am too savage;"
IV,II,71,MESSENGER,1533-0.txt,2973,"To do worse to you were fell cruelty,"
IV,II,72,MESSENGER,1533-0.txt,2974,Which is too nigh your person. Heaven preserve you!
IV,II,73,MESSENGER,1533-0.txt,2975,I dare abide no longer.
IV,II,73,---,1533-0.txt,2977,[Exit.]
IV,II,74,LADY MACDUFF,1533-0.txt,2980,Whither should I fly?
IV,II,75,LADY MACDUFF,1533-0.txt,2981,I have done no harm. But I remember now
IV,II,76,LADY MACDUFF,1533-0.txt,2982,"I am in this earthly world, where to do harm"
IV,II,77,LADY MACDUFF,1533-0.txt,2983,Is often laudable; to do good sometime
IV,II,78,LADY MACDUFF,1533-0.txt,2984,"Accounted dangerous folly:  why then, alas,"
IV,II,79,LADY MACDUFF,1533-0.txt,2985,"Do I put up that womanly defence,"
IV,II,80,LADY MACDUFF,1533-0.txt,2986,To say I have done no harm? What are these faces?
IV,II,80,---,1533-0.txt,2988,Enter Murderers.
IV,II,81,FIRST MURDERER,1533-0.txt,2991,Where is your husband?
IV,II,82,LADY MACDUFF,1533-0.txt,2994,"I hope, in no place so unsanctified"
IV,II,83,LADY MACDUFF,1533-0.txt,2995,Where such as thou mayst find him.
IV,II,84,FIRST MURDERER,1533-0.txt,2998,He’s a traitor.
IV,II,85,SON,1533-0.txt,3001,"Thou liest, thou shag-ear’d villain!"
IV,II,86,FIRST MURDERER,1533-0.txt,3004,"What, you egg!"
IV,II,86,---,1533-0.txt,3006,[Stabbing him.]
IV,II,87,FIRST MURDERER,1533-0.txt,3008,Young fry of treachery!
IV,II,88,SON,1533-0.txt,3011,"He has kill’d me, mother:"
IV,II,89,SON,1533-0.txt,3012,"Run away, I pray you!"
IV,II,89,---,1533-0.txt,3014,"[Dies. Exit Lady Macduff, crying “Murder!” and pursued by the Murderers.]"
IV,III,0,---,1533-0.txt,3019,Enter Malcolm and Macduff.
IV,III,1,MALCOLM,1533-0.txt,3022,Let us seek out some desolate shade and there
IV,III,2,MALCOLM,1533-0.txt,3023,Weep our sad bosoms empty.
IV,III,3,MACDUFF,1533-0.txt,3026,Let us rather
IV,III,4,MACDUFF,1533-0.txt,3027,"Hold fast the mortal sword, and, like good men,"
IV,III,5,MACDUFF,1533-0.txt,3028,Bestride our down-fall’n birthdom. Each new morn
IV,III,6,MACDUFF,1533-0.txt,3029,"New widows howl, new orphans cry; new sorrows"
IV,III,7,MACDUFF,1533-0.txt,3030,"Strike heaven on the face, that it resounds"
IV,III,8,MACDUFF,1533-0.txt,3031,"As if it felt with Scotland, and yell’d out"
IV,III,9,MACDUFF,1533-0.txt,3032,Like syllable of dolour.
